{
  "format": "cdxml-om-sdk-extension-feature-cases",
  "version": 1,
  "source_evidence": "schema/sources/sdk/evidence.json",
  "raw_preservation_test": "tests/coverage/test_sdk_extension_feature_evidence.py::test_sdk_extension_raw_attributes_survive_an_unrelated_edit",
  "cases": [
    {
      "case_id": "feature-sdk:n@bgcolor",
      "owner_tag": "n",
      "xml_attribute": "bgcolor",
      "source_xml": "2",
      "sdk_type": "INT16",
      "typed_status": "typed",
      "typed_recipe": {
        "expected_python_type": "int",
        "expected_python_value": 2,
        "mutation_python_value": 3,
        "mutation_xml": "3",
        "required_assertions": [
          "typed_read_value_and_python_type",
          "typed_mutation",
          "mutation_lexical_value",
          "serialization_reload_typed_readback"
        ],
        "pytest_nodeid": "tests/coverage/test_sdk_extension_feature_evidence.py::test_sdk_extension_typed_mutation_roundtrip[feature-sdk:n@bgcolor]",
        "field_name": "bgcolor"
      },
      "assertions": [
        "raw_lexical_read",
        "unrelated_edit_preserves_raw",
        "serialization_reload_preserves_raw"
      ],
      "pytest_nodeid": "tests/coverage/test_sdk_extension_feature_evidence.py::test_sdk_extension_raw_attributes_survive_an_unrelated_edit[feature-sdk:n@bgcolor]"
    },
    {
      "case_id": "feature-sdk:b@bgcolor",
      "owner_tag": "b",
      "xml_attribute": "bgcolor",
      "source_xml": "2",
      "sdk_type": "INT16",
      "typed_status": "typed",
      "typed_recipe": {
        "expected_python_type": "int",
        "expected_python_value": 2,
        "mutation_python_value": 3,
        "mutation_xml": "3",
        "required_assertions": [
          "typed_read_value_and_python_type",
          "typed_mutation",
          "mutation_lexical_value",
          "serialization_reload_typed_readback"
        ],
        "pytest_nodeid": "tests/coverage/test_sdk_extension_feature_evidence.py::test_sdk_extension_typed_mutation_roundtrip[feature-sdk:b@bgcolor]",
        "field_name": "bgcolor"
      },
      "assertions": [
        "raw_lexical_read",
        "unrelated_edit_preserves_raw",
        "serialization_reload_preserves_raw"
      ],
      "pytest_nodeid": "tests/coverage/test_sdk_extension_feature_evidence.py::test_sdk_extension_raw_attributes_survive_an_unrelated_edit[feature-sdk:b@bgcolor]"
    },
    {
      "case_id": "feature-sdk:graphic@bgcolor",
      "owner_tag": "graphic",
      "xml_attribute": "bgcolor",
      "source_xml": "2",
      "sdk_type": "INT16",
      "typed_status": "typed",
      "typed_recipe": {
        "expected_python_type": "int",
        "expected_python_value": 2,
        "mutation_python_value": 3,
        "mutation_xml": "3",
        "required_assertions": [
          "typed_read_value_and_python_type",
          "typed_mutation",
          "mutation_lexical_value",
          "serialization_reload_typed_readback"
        ],
        "pytest_nodeid": "tests/coverage/test_sdk_extension_feature_evidence.py::test_sdk_extension_typed_mutation_roundtrip[feature-sdk:graphic@bgcolor]",
        "field_name": "bgcolor"
      },
      "assertions": [
        "raw_lexical_read",
        "unrelated_edit_preserves_raw",
        "serialization_reload_preserves_raw"
      ],
      "pytest_nodeid": "tests/coverage/test_sdk_extension_feature_evidence.py::test_sdk_extension_raw_attributes_survive_an_unrelated_edit[feature-sdk:graphic@bgcolor]"
    },
    {
      "case_id": "feature-sdk:curve@bgcolor",
      "owner_tag": "curve",
      "xml_attribute": "bgcolor",
      "source_xml": "2",
      "sdk_type": "INT16",
      "typed_status": "typed",
      "typed_recipe": {
        "expected_python_type": "int",
        "expected_python_value": 2,
        "mutation_python_value": 3,
        "mutation_xml": "3",
        "required_assertions": [
          "typed_read_value_and_python_type",
          "typed_mutation",
          "mutation_lexical_value",
          "serialization_reload_typed_readback"
        ],
        "pytest_nodeid": "tests/coverage/test_sdk_extension_feature_evidence.py::test_sdk_extension_typed_mutation_roundtrip[feature-sdk:curve@bgcolor]",
        "field_name": "bgcolor"
      },
      "assertions": [
        "raw_lexical_read",
        "unrelated_edit_preserves_raw",
        "serialization_reload_preserves_raw"
      ],
      "pytest_nodeid": "tests/coverage/test_sdk_extension_feature_evidence.py::test_sdk_extension_raw_attributes_survive_an_unrelated_edit[feature-sdk:curve@bgcolor]"
    },
    {
      "case_id": "feature-sdk:curve@ArrowHeadType",
      "owner_tag": "curve",
      "xml_attribute": "ArrowHeadType",
      "source_xml": "Hollow",
      "sdk_type": "INT16",
      "typed_status": "typed",
      "typed_recipe": {
        "expected_python_type": "ArrowheadType",
        "expected_python_value": "Hollow",
        "mutation_python_value": "Angle",
        "mutation_xml": "Angle",
        "required_assertions": [
          "typed_read_value_and_python_type",
          "typed_mutation",
          "mutation_lexical_value",
          "serialization_reload_typed_readback"
        ],
        "pytest_nodeid": "tests/coverage/test_sdk_extension_feature_evidence.py::test_sdk_extension_typed_mutation_roundtrip[feature-sdk:curve@ArrowHeadType]",
        "field_name": "arrowhead_type"
      },
      "assertions": [
        "raw_lexical_read",
        "unrelated_edit_preserves_raw",
        "serialization_reload_preserves_raw"
      ],
      "pytest_nodeid": "tests/coverage/test_sdk_extension_feature_evidence.py::test_sdk_extension_raw_attributes_survive_an_unrelated_edit[feature-sdk:curve@ArrowHeadType]"
    },
    {
      "case_id": "feature-sdk:curve@ArrowHeadHead",
      "owner_tag": "curve",
      "xml_attribute": "ArrowHeadHead",
      "source_xml": "HalfLeft",
      "sdk_type": "INT16",
      "typed_status": "typed",
      "typed_recipe": {
        "expected_python_type": "ArrowheadSide",
        "expected_python_value": "HalfLeft",
        "mutation_python_value": "Full",
        "mutation_xml": "Full",
        "required_assertions": [
          "typed_read_value_and_python_type",
          "typed_mutation",
          "mutation_lexical_value",
          "serialization_reload_typed_readback"
        ],
        "pytest_nodeid": "tests/coverage/test_sdk_extension_feature_evidence.py::test_sdk_extension_typed_mutation_roundtrip[feature-sdk:curve@ArrowHeadHead]",
        "field_name": "arrowhead_head"
      },
      "assertions": [
        "raw_lexical_read",
        "unrelated_edit_preserves_raw",
        "serialization_reload_preserves_raw"
      ],
      "pytest_nodeid": "tests/coverage/test_sdk_extension_feature_evidence.py::test_sdk_extension_raw_attributes_survive_an_unrelated_edit[feature-sdk:curve@ArrowHeadHead]"
    },
    {
      "case_id": "feature-sdk:curve@ArrowHeadTail",
      "owner_tag": "curve",
      "xml_attribute": "ArrowHeadTail",
      "source_xml": "None",
      "sdk_type": "INT16",
      "typed_status": "typed",
      "typed_recipe": {
        "expected_python_type": "ArrowheadSide",
        "expected_python_value": "None",
        "mutation_python_value": "HalfRight",
        "mutation_xml": "HalfRight",
        "required_assertions": [
          "typed_read_value_and_python_type",
          "typed_mutation",
          "mutation_lexical_value",
          "serialization_reload_typed_readback"
        ],
        "pytest_nodeid": "tests/coverage/test_sdk_extension_feature_evidence.py::test_sdk_extension_typed_mutation_roundtrip[feature-sdk:curve@ArrowHeadTail]",
        "field_name": "arrowhead_tail"
      },
      "assertions": [
        "raw_lexical_read",
        "unrelated_edit_preserves_raw",
        "serialization_reload_preserves_raw"
      ],
      "pytest_nodeid": "tests/coverage/test_sdk_extension_feature_evidence.py::test_sdk_extension_raw_attributes_survive_an_unrelated_edit[feature-sdk:curve@ArrowHeadTail]"
    },
    {
      "case_id": "feature-sdk:embeddedobject@bgcolor",
      "owner_tag": "embeddedobject",
      "xml_attribute": "bgcolor",
      "source_xml": "2",
      "sdk_type": "INT16",
      "typed_status": "typed",
      "typed_recipe": {
        "expected_python_type": "int",
        "expected_python_value": 2,
        "mutation_python_value": 3,
        "mutation_xml": "3",
        "required_assertions": [
          "typed_read_value_and_python_type",
          "typed_mutation",
          "mutation_lexical_value",
          "serialization_reload_typed_readback"
        ],
        "pytest_nodeid": "tests/coverage/test_sdk_extension_feature_evidence.py::test_sdk_extension_typed_mutation_roundtrip[feature-sdk:embeddedobject@bgcolor]",
        "field_name": "bgcolor"
      },
      "assertions": [
        "raw_lexical_read",
        "unrelated_edit_preserves_raw",
        "serialization_reload_preserves_raw"
      ],
      "pytest_nodeid": "tests/coverage/test_sdk_extension_feature_evidence.py::test_sdk_extension_raw_attributes_survive_an_unrelated_edit[feature-sdk:embeddedobject@bgcolor]"
    },
    {
      "case_id": "feature-sdk:table@bgcolor",
      "owner_tag": "table",
      "xml_attribute": "bgcolor",
      "source_xml": "2",
      "sdk_type": "INT16",
      "typed_status": "typed",
      "typed_recipe": {
        "expected_python_type": "int",
        "expected_python_value": 2,
        "mutation_python_value": 3,
        "mutation_xml": "3",
        "required_assertions": [
          "typed_read_value_and_python_type",
          "typed_mutation",
          "mutation_lexical_value",
          "serialization_reload_typed_readback"
        ],
        "pytest_nodeid": "tests/coverage/test_sdk_extension_feature_evidence.py::test_sdk_extension_typed_mutation_roundtrip[feature-sdk:table@bgcolor]",
        "field_name": "bgcolor"
      },
      "assertions": [
        "raw_lexical_read",
        "unrelated_edit_preserves_raw",
        "serialization_reload_preserves_raw"